{"candidateCredentialCheck":"passed","schemaVersion":"dataground.dev.openshell-runtime-diagnostic/v3","certificationEligible":false,"profile":{"runtimePolicySHA256":"d7f510e5332068cea5106de5351973dc60f15e22e970fa9352a75d3bbd32b95d","openshellCommit":"d556748771c41cbbd4e4dd7cd9030c798afe2b7d","gatewayImage":"ghcr.io/nvidia/openshell/gateway@sha256:e21f520a0678ba3cfe749957338b5fa78c75e8e52de13e4559ccbb582f781a0b","supervisorImage":"ghcr.io/nvidia/openshell/supervisor@sha256:a15222ac18c1afd0ee51b9dda785a29067c13f61a2002a29d41f691f5e817f19","sandboxImage":"sha256:9fff9875097a3608fce25e0d401cacc70ad10113237683fe907e45d94e4b24a1","runtimeVersion":"0.117.0","runtimeSchemaCanonicalSHA256":"0668eee0081dc5b643ecc7821938ad174f3d532a313a092f387fed3b469876ea","gatewayEndpoint":"http://127.0.0.1:8080","driver":"docker","composeSHA256":"e0c3a67c3b5976dc22e32e47614a1f8f08aaaa2ddfc0c376240641a391066762","gatewayConfigSHA256":"16f5d7a5e7d1dad1be67ede22d7b9d70e76517c98c6c9a4a4c2eb89eead08651"},"run":{"id":"0d4d0e9a05e317cfcd674f0a3018247b","resources":{"gateway":"dg-runtime-gateway-0d4d0e9a05e317cfcd674f0a3018247b","sandbox":"dg-runtime-sandbox-0d4d0e9a05e317cfcd674f0a3018247b","provider":"dg-runtime-provider-0d4d0e9a05e317cfcd674f0a3018247b","runtime":"dg-runtime-session-0d4d0e9a05e317cfcd674f0a3018247b","workspace":"dg-runtime-0d4d0e9a05e317cfcd674f0a3018247b"},"startedAt":"2026-09-06T10:14:04.051999581Z","finishedAt":"2026-09-06T10:14:45.542614448Z","origin":"local","sourceCommit":"e7a0839bfcaa6a9d95540224a63c02be45bb89e1","model":"gpt-6-astra"},"checks":[{"name":"gateway-ready","status":"passed","startedAt":"2026-09-06T10:14:04.052007206Z","finishedAt":"2026-09-06T10:14:04.052008581Z","observationCommitment":"sha256:ee286a6b426bf9294f78a26e52dffa741ebbd068bf1cfec97ce6143153e23ea1","nativeProtocolExposed":false,"upstreamEndpointExposed":false},{"name":"sandbox-ready","status":"passed","startedAt":"2026-09-06T10:14:04.052025123Z","finishedAt":"2026-09-06T10:14:04.055922722Z","observationCommitment":"sha256:7236bb8267330d7f03d9e4fe9bdad78950967e91a2ba49df31599a57fa21d5bb","nativeProtocolExposed":false,"upstreamEndpointExposed":false},{"name":"initialize","status":"passed","startedAt":"2026-09-06T10:14:04.055943681Z","finishedAt":"2026-09-06T10:14:04.381860096Z","observationCommitment":"sha256:6a1efcdd737b5563742a4990893c33735a67fb6e97ac4446982d2e4ce9d84f7a","nativeProtocolExposed":false,"upstreamEndpointExposed":false},{"name":"turn-success","status":"passed","startedAt":"2026-09-06T10:14:04.38190893Z","finishedAt":"2026-09-06T10:14:09.720039865Z","observationCommitment":"sha256:8dcf19adf7868397ca8e919d96cb6250f5b560f81bc4734f0d8efb2c76734875","nativeProtocolExposed":false,"upstreamEndpointExposed":false},{"name":"turn-failure","status":"passed","startedAt":"2026-09-06T10:14:09.720117241Z","finishedAt":"2026-09-06T10:14:10.529495268Z","observationCommitment":"sha256:148f449244cca7f3adfc05a9a1f4c5de4b47d4064ab5550ecc527bff5e3da2ec","nativeProtocolExposed":false,"upstreamEndpointExposed":false},{"name":"event-normalization","status":"passed","startedAt":"2026-09-06T10:14:10.529574227Z","finishedAt":"2026-09-06T10:14:19.753703866Z","observationCommitment":"sha256:4118c0b2b20e2075d8772afcf13392bce6b7e8afb4d955c544ba7141ab2a357a","nativeProtocolExposed":false,"upstreamEndpointExposed":false},{"name":"interrupt","status":"passed","startedAt":"2026-09-06T10:14:19.753785325Z","finishedAt":"2026-09-06T10:14:20.052029758Z","observationCommitment":"sha256:557ad9f332bac8e91b2da620fdd9d0f8933199729f9c5e4a5deeb6bbc8e20618","nativeProtocolExposed":false,"upstreamEndpointExposed":false},{"name":"cancellation","status":"passed","startedAt":"2026-09-06T10:14:20.052064884Z","finishedAt":"2026-09-06T10:14:20.357287163Z","observationCommitment":"sha256:52e0df4ab53e0ec5639afa46ba1ef52965f7db980762829d513d78e44b125742","nativeProtocolExposed":false,"upstreamEndpointExposed":false},{"name":"command-approval","status":"passed","startedAt":"2026-09-06T10:14:20.357320789Z","finishedAt":"2026-09-06T10:14:26.605947994Z","observationCommitment":"sha256:68ddad5071c2ab71b2df1a8cb4282055515d107b90e47ec294132ef3c59330ed","nativeProtocolExposed":false,"upstreamEndpointExposed":false},{"name":"file-change-approval","status":"passed","startedAt":"2026-09-06T10:14:26.60602187Z","finishedAt":"2026-09-06T10:14:34.709895988Z","observationCommitment":"sha256:5e1dc3b5e64e75e28195fbc1d3d58a6be792fbe432c02cb2f2eed77076e925de","nativeProtocolExposed":false,"upstreamEndpointExposed":false},{"name":"artifact-export","status":"passed","startedAt":"2026-09-06T10:14:34.709982281Z","finishedAt":"2026-09-06T10:14:45.346683199Z","observationCommitment":"sha256:a8db69b8d4331efb45ce427a8fd3324f9a4d579baa46724b3e845f2c1293611c","nativeProtocolExposed":false,"upstreamEndpointExposed":false},{"name":"sandbox-teardown","status":"passed","startedAt":"2026-09-06T10:14:45.346740533Z","finishedAt":"2026-09-06T10:14:45.476049472Z","observationCommitment":"sha256:6ad831fe625c0c010e2dfa70ce036be1edfe275dc231173cae5bd3b51b3dbe99","nativeProtocolExposed":false,"upstreamEndpointExposed":false}],"cleanup":{"sandbox":{"name":"dg-runtime-sandbox-0d4d0e9a05e317cfcd674f0a3018247b","status":"removed"},"providerBinding":{"name":"dg-runtime-provider-0d4d0e9a05e317cfcd674f0a3018247b","status":"removed"},"workspace":{"name":"dg-runtime-0d4d0e9a05e317cfcd674f0a3018247b","status":"removed"}},"result":"passed"}
