{"candidateCredentialCheck":"passed","schemaVersion":"dataground.dev.openshell-runtime-diagnostic/v3","certificationEligible":false,"profile":{"runtimePolicySHA256":"d7f510e5332068cea5106de5351973dc60f15e22e970fa9352a75d3bbd32b95d","openshellCommit":"d556748771c41cbbd4e4dd7cd9030c798afe2b7d","gatewayImage":"ghcr.io/nvidia/openshell/gateway@sha256:e21f520a0678ba3cfe749957338b5fa78c75e8e52de13e4559ccbb582f781a0b","supervisorImage":"ghcr.io/nvidia/openshell/supervisor@sha256:a15222ac18c1afd0ee51b9dda785a29067c13f61a2002a29d41f691f5e817f19","sandboxImage":"sha256:703abdf5d88c6298423ba25cb11340990169b4f535b1b75ecc9fb4b730165573","runtimeVersion":"0.117.0","runtimeSchemaCanonicalSHA256":"0668eee0081dc5b643ecc7821938ad174f3d532a313a092f387fed3b469876ea","gatewayEndpoint":"http://127.0.0.1:8080","driver":"docker","composeSHA256":"e0c3a67c3b5976dc22e32e47614a1f8f08aaaa2ddfc0c376240641a391066762","gatewayConfigSHA256":"16f5d7a5e7d1dad1be67ede22d7b9d70e76517c98c6c9a4a4c2eb89eead08651"},"run":{"id":"522d0b3d90332953e87e2026177cd86e","resources":{"gateway":"dg-runtime-gateway-522d0b3d90332953e87e2026177cd86e","sandbox":"dg-runtime-sandbox-522d0b3d90332953e87e2026177cd86e","provider":"dg-runtime-provider-522d0b3d90332953e87e2026177cd86e","runtime":"dg-runtime-session-522d0b3d90332953e87e2026177cd86e","workspace":"dg-runtime-522d0b3d90332953e87e2026177cd86e"},"startedAt":"2026-09-06T08:38:03.771260413Z","finishedAt":"2026-09-06T08:38:40.801393871Z","origin":"local","sourceCommit":"fed7191b2543c53842cb8310149ff3c359e8c6f5","model":"gpt-6-astra"},"checks":[{"name":"gateway-ready","status":"passed","startedAt":"2026-09-06T08:38:03.771266455Z","finishedAt":"2026-09-06T08:38:03.77126733Z","observationCommitment":"sha256:bfd29e373c95f447f2f24efbd913485f0ff127162f758ade7456be3a62d45d4b","nativeProtocolExposed":false,"upstreamEndpointExposed":false},{"name":"sandbox-ready","status":"passed","startedAt":"2026-09-06T08:38:03.77127683Z","finishedAt":"2026-09-06T08:38:03.774048479Z","observationCommitment":"sha256:4b0ecdbfadafaba7a4c069117af3726c3e98b21b27efa6963dbf065ce3e84321","nativeProtocolExposed":false,"upstreamEndpointExposed":false},{"name":"initialize","status":"passed","startedAt":"2026-09-06T08:38:03.774061646Z","finishedAt":"2026-09-06T08:38:04.041114409Z","observationCommitment":"sha256:4ad8aeaf7f1b63606e338812db88cafbc08de51d62e70e113f3ca78cc30b2ec9","nativeProtocolExposed":false,"upstreamEndpointExposed":false},{"name":"turn-success","status":"passed","startedAt":"2026-09-06T08:38:04.041168368Z","finishedAt":"2026-09-06T08:38:08.612647828Z","observationCommitment":"sha256:d7485169ab425835762d91ed14c78f2688e732373b81348f2b9b61f826f399ea","nativeProtocolExposed":false,"upstreamEndpointExposed":false},{"name":"turn-failure","status":"passed","startedAt":"2026-09-06T08:38:08.612700495Z","finishedAt":"2026-09-06T08:38:09.2881745Z","observationCommitment":"sha256:4bcbfc833e9fabfb554ec8f96b6fd0ceb2ab3ac74cfa5833b0c165bf7f457b83","nativeProtocolExposed":false,"upstreamEndpointExposed":false},{"name":"event-normalization","status":"passed","startedAt":"2026-09-06T08:38:09.2882185Z","finishedAt":"2026-09-06T08:38:19.139046416Z","observationCommitment":"sha256:3c174bb9606e1d72e38d4ce5113979a75c6e6fd32db0fe9bb22c7df4d42fa8c2","nativeProtocolExposed":false,"upstreamEndpointExposed":false},{"name":"interrupt","status":"passed","startedAt":"2026-09-06T08:38:19.139106417Z","finishedAt":"2026-09-06T08:38:19.517358167Z","observationCommitment":"sha256:6cd3a4a53c19d35776093449df468b7b7408790fc5fe3857919e821956900b88","nativeProtocolExposed":false,"upstreamEndpointExposed":false},{"name":"cancellation","status":"passed","startedAt":"2026-09-06T08:38:19.517385834Z","finishedAt":"2026-09-06T08:38:19.844089397Z","observationCommitment":"sha256:bfc96461e4a95a0af5f9db4564824cbb2bd9433a25721206784e96d05a594dfa","nativeProtocolExposed":false,"upstreamEndpointExposed":false},{"name":"command-approval","status":"passed","startedAt":"2026-09-06T08:38:19.844117481Z","finishedAt":"2026-09-06T08:38:24.772989622Z","observationCommitment":"sha256:e47eab0e5575e01d589d9f012af094b750417b9e5d5dac4bd25c119c830994b8","nativeProtocolExposed":false,"upstreamEndpointExposed":false},{"name":"file-change-approval","status":"passed","startedAt":"2026-09-06T08:38:24.773047581Z","finishedAt":"2026-09-06T08:38:31.552799099Z","observationCommitment":"sha256:79585ad8f7fa27a7365ebfe3122e22fe668e76d05b7cd61d7ed269da9fd4af1e","nativeProtocolExposed":false,"upstreamEndpointExposed":false},{"name":"artifact-export","status":"passed","startedAt":"2026-09-06T08:38:31.553075602Z","finishedAt":"2026-09-06T08:38:40.68527245Z","observationCommitment":"sha256:731ad35df09a266d306a8df0818349ec374875e0ea326e8bdfece2edbfb2c423","nativeProtocolExposed":false,"upstreamEndpointExposed":false},{"name":"sandbox-teardown","status":"passed","startedAt":"2026-09-06T08:38:40.685306867Z","finishedAt":"2026-09-06T08:38:40.78835793Z","observationCommitment":"sha256:15c6038b1eb4941e8886f4c21dfea6fdfc640d8fe8436885746ba5c31768651f","nativeProtocolExposed":false,"upstreamEndpointExposed":false}],"cleanup":{"sandbox":{"name":"dg-runtime-sandbox-522d0b3d90332953e87e2026177cd86e","status":"removed"},"providerBinding":{"name":"dg-runtime-provider-522d0b3d90332953e87e2026177cd86e","status":"removed"},"workspace":{"name":"dg-runtime-522d0b3d90332953e87e2026177cd86e","status":"removed"}},"result":"passed"}
